{
  "schema_version": "v1alpha1",
  "root_taskpack_id": "4e1fe00c-6303-453c-8cb6-2c34f84896e4",
  "taskpack": {
    "schema_version": "v1alpha1",
    "taskpack_id": "4e1fe00c-6303-453c-8cb6-2c34f84896e4",
    "institution_id": "5d3dca03-89a0-4fb0-99ee-5f39ef5a6f0c",
    "title": "Audit the payment webhook retry path",
    "objective": "Find retry edge cases, propose fixes, and produce an implementation plan.",
    "task_type": "analysis",
    "priority": "high",
    "requested_by": {
      "actor_id": "52a203e8-0a20-4f0b-9b3d-78631e00d6ab",
      "actor_type": "human",
      "display_name": "Quentin"
    },
    "context_budget": {
      "max_input_tokens": 12000,
      "max_output_tokens": 2500,
      "context_strategy": "artifact_refs_first"
    },
    "permissions": {
      "allow_network": false,
      "allow_shell": false,
      "allow_external_write": false,
      "approval_mode": "ask"
    },
    "acceptance_criteria": [
      {
        "criterion_id": "root-cause",
        "description": "Identify at least one likely duplicate side-effect path.",
        "required": true
      }
    ],
    "created_at": "2026-04-24T10:00:00Z"
  },
  "taskpacks": [
    {
      "schema_version": "v1alpha1",
      "taskpack_id": "4e1fe00c-6303-453c-8cb6-2c34f84896e4",
      "institution_id": "5d3dca03-89a0-4fb0-99ee-5f39ef5a6f0c",
      "title": "Audit the payment webhook retry path",
      "objective": "Find retry edge cases, propose fixes, and produce an implementation plan.",
      "task_type": "analysis",
      "priority": "high",
      "requested_by": {
        "actor_id": "52a203e8-0a20-4f0b-9b3d-78631e00d6ab",
        "actor_type": "human",
        "display_name": "Quentin"
      },
      "context_budget": {
        "max_input_tokens": 12000,
        "max_output_tokens": 2500,
        "context_strategy": "artifact_refs_first"
      },
      "permissions": {
        "allow_network": false,
        "allow_shell": false,
        "allow_external_write": false,
        "approval_mode": "ask"
      },
      "acceptance_criteria": [
        {
          "criterion_id": "root-cause",
          "description": "Identify at least one likely duplicate side-effect path.",
          "required": true
        }
      ],
      "created_at": "2026-04-24T10:00:00Z"
    }
  ],
  "dri_bindings": [
    {
      "schema_version": "v1alpha1",
      "dri_binding_id": "19887415-bb68-438b-9599-0b07b5f13e97",
      "taskpack_id": "4e1fe00c-6303-453c-8cb6-2c34f84896e4",
      "owner": {
        "actor_id": "0a3657eb-2f37-4614-a8a7-9c6bd51714a8",
        "actor_type": "agent",
        "display_name": "payments-dri",
        "orchestrator": "langgraph",
        "model": "anthropic:claude-sonnet-4"
      },
      "status": "assigned",
      "created_at": "2026-04-24T10:01:00Z"
    }
  ],
  "artifacts": [
    {
      "schema_version": "v1alpha1",
      "artifact_id": "5d19ef0f-31b5-4709-a66b-da2d3bb4a731",
      "taskpack_id": "4e1fe00c-6303-453c-8cb6-2c34f84896e4",
      "kind": "review",
      "title": "Webhook retry audit findings",
      "summary": "Identifies duplicate side effects in timeout retry handling and proposes an idempotency guard.",
      "producer": {
        "actor_id": "0a3657eb-2f37-4614-a8a7-9c6bd51714a8",
        "actor_type": "agent",
        "display_name": "payments-dri",
        "orchestrator": "langgraph",
        "model": "anthropic:claude-sonnet-4"
      },
      "storage": {
        "uri": "s3://guild/artifacts/tasks/4e1fe00c-6303-453c-8cb6-2c34f84896e4/findings.md",
        "mime_type": "text/markdown"
      },
      "version": 1,
      "created_at": "2026-04-24T10:15:00Z"
    }
  ],
  "promotion_records": [
    {
      "schema_version": "v1alpha1",
      "promotion_record_id": "b2ddb0dd-b29c-4a28-b1ba-e9a2f8ff23fb",
      "institution_id": "5d3dca03-89a0-4fb0-99ee-5f39ef5a6f0c",
      "candidate_kind": "review_heuristic",
      "candidate_ref": {
        "artifact_id": "5d19ef0f-31b5-4709-a66b-da2d3bb4a731",
        "kind": "review",
        "uri": "s3://guild/artifacts/tasks/4e1fe00c-6303-453c-8cb6-2c34f84896e4/findings.md",
        "version": 1
      },
      "decision": "accepted",
      "decision_reason": "Catch-rate improvement outweighed the small latency cost and no policy regressions were observed.",
      "decided_at": "2026-04-24T11:00:00Z"
    }
  ]
}
